{
  "schema_version": 1,
  "contract_id": "goreecloud.privacy-shield.state-provider-evaluation.v1",
  "evaluation_id": "foundationdb-self-hosted-multihost-production",
  "provider_id": "foundationdb-self-hosted-multihost",
  "provider_name": "FoundationDB self-hosted multi-host cluster",
  "provider_implementation": "FoundationDB self-hosted multi-host cluster",
  "integration_authority": "GoreeCloud/goreecloud-privacy-shield",
  "scope": {
    "service": "privacy-shield",
    "capability": "durable-authorization-state",
    "authority_state": [
      "consent",
      "policy_versions_and_active_pointer",
      "capability_revocation",
      "single_use_capability_consumption",
      "privacy_evidence_and_chain_head"
    ],
    "environments": [
      "production"
    ]
  },
  "criteria": {
    "durability": {
      "result": "passed",
      "evidence_refs": [
        "evidence+sha256:48f47b24f596a1756c11a1150d49a77ade9d0a923be28ed105738c08a2c03be8:github://GoreeCloud/goreecloud-privacy-shield/evidence/provider-evaluations/foundationdb-state-candidate-20260919.md"
      ]
    },
    "restart_recovery": {
      "result": "pending",
      "evidence_refs": [
        "evidence+sha256:0ca034c0f7618b2684006f0b6dc47c8720de410b36da131f3405e30b1806ca30:github://GoreeCloud/goreecloud-privacy-shield/evidence/provider-evaluations/foundationdb-operational-security-candidate-20260919.md"
      ]
    },
    "atomic_transactions": {
      "result": "passed",
      "evidence_refs": [
        "evidence+sha256:48f47b24f596a1756c11a1150d49a77ade9d0a923be28ed105738c08a2c03be8:github://GoreeCloud/goreecloud-privacy-shield/evidence/provider-evaluations/foundationdb-state-candidate-20260919.md"
      ]
    },
    "multi_writer_serializability": {
      "result": "passed",
      "evidence_refs": [
        "evidence+sha256:48f47b24f596a1756c11a1150d49a77ade9d0a923be28ed105738c08a2c03be8:github://GoreeCloud/goreecloud-privacy-shield/evidence/provider-evaluations/foundationdb-state-candidate-20260919.md"
      ]
    },
    "distributed_topology": {
      "result": "passed",
      "evidence_refs": [
        "evidence+sha256:48f47b24f596a1756c11a1150d49a77ade9d0a923be28ed105738c08a2c03be8:github://GoreeCloud/goreecloud-privacy-shield/evidence/provider-evaluations/foundationdb-state-candidate-20260919.md"
      ]
    },
    "fail_closed_conflict_behavior": {
      "result": "pending",
      "evidence_refs": [
        "evidence+sha256:48f47b24f596a1756c11a1150d49a77ade9d0a923be28ed105738c08a2c03be8:github://GoreeCloud/goreecloud-privacy-shield/evidence/provider-evaluations/foundationdb-state-candidate-20260919.md"
      ]
    },
    "backup_restore": {
      "result": "passed",
      "evidence_refs": [
        "evidence+sha256:48f47b24f596a1756c11a1150d49a77ade9d0a923be28ed105738c08a2c03be8:github://GoreeCloud/goreecloud-privacy-shield/evidence/provider-evaluations/foundationdb-state-candidate-20260919.md"
      ]
    },
    "migration_rollback": {
      "result": "pending",
      "evidence_refs": [
        "evidence+sha256:0ca034c0f7618b2684006f0b6dc47c8720de410b36da131f3405e30b1806ca30:github://GoreeCloud/goreecloud-privacy-shield/evidence/provider-evaluations/foundationdb-operational-security-candidate-20260919.md"
      ]
    },
    "access_control_isolation": {
      "result": "failed",
      "evidence_refs": [
        "evidence+sha256:0ca034c0f7618b2684006f0b6dc47c8720de410b36da131f3405e30b1806ca30:github://GoreeCloud/goreecloud-privacy-shield/evidence/provider-evaluations/foundationdb-operational-security-candidate-20260919.md"
      ]
    },
    "privacy_safe_observability": {
      "result": "pending",
      "evidence_refs": [
        "evidence+sha256:0ca034c0f7618b2684006f0b6dc47c8720de410b36da131f3405e30b1806ca30:github://GoreeCloud/goreecloud-privacy-shield/evidence/provider-evaluations/foundationdb-operational-security-candidate-20260919.md"
      ]
    },
    "operational_ownership": {
      "result": "pending",
      "evidence_refs": [
        "evidence+sha256:0ca034c0f7618b2684006f0b6dc47c8720de410b36da131f3405e30b1806ca30:github://GoreeCloud/goreecloud-privacy-shield/evidence/provider-evaluations/foundationdb-operational-security-candidate-20260919.md"
      ]
    }
  },
  "governance": {
    "status": "failed",
    "authorizing": false,
    "production_acceptance_authorized": false,
    "evidence_reference": "evidence+sha256:48f47b24f596a1756c11a1150d49a77ade9d0a923be28ed105738c08a2c03be8:github://GoreeCloud/goreecloud-privacy-shield/evidence/provider-evaluations/foundationdb-state-candidate-20260919.md",
    "evaluated_at": "2026-09-20T00:34:23Z",
    "valid_until": "2026-10-19T22:10:00Z"
  },
  "privacy": {
    "credentials_in_evaluation_record": false,
    "raw_private_payloads_in_evaluation_record": false,
    "secret_material_in_evaluation_record": false
  },
  "limitations": [
    "Current candidate evaluation is failed because FoundationDB does not provide production-grade user-level access-control isolation for this scope; upstream documentation states connected clients can read and write every key, while tenants remain experimental and are not accepted as a production boundary.",
    "Provider capability evidence supports durability, atomic transactions, strict multi-writer serializability, distributed multi-host architecture, and backup/restore as candidate capabilities; deployment-dependent restart, conflict/failure behavior, migration/rollback, privacy-safe observability, and operational ownership remain pending.",
    "Current GoreeCloud production topology has one VPS and cannot qualify the intended failure-isolated multi-host deployment; at least three genuinely failure-isolated hosts plus exact network, TLS, backup, restore, observability, and rollback qualification would still be required for any revised candidate.",
    "This failed candidate evaluation is non-authorizing and does not select a provider, authorize infrastructure purchase or deployment, create production acceptance, or establish Privacy Shield production readiness."
  ]
}
